category;name;rus;eng

feature_skill;emilie_cleardew_cologne_dmg;Урон Парфюма ясных рос;Cleardew Cologne DMG
feature_other;emilie_dmg_bonus;Бонус урона;DMG Bonus

stat;dmg_skill_emilie;Извлечение ароматов;Fragrance Extraction

talent_name;emilie_headspace_capture;Сбор ароматов из пространства;Headspace Capture
talent_descr;emilie_headspace_capture;Когда созданная самой name{Эмилией} name{Шкатулка Люмидус} находится на поле боя, pyro{Пиро сопротивление} урону от pyro{Горения} всех членов отряда поблизости повышается на %{text_percent_res}.;When the name{Lumidouce Case} created by name{Emilie} is on the field, all party members gain %{text_percent_res} pyro{Pyro RES} against pyro{Burning} DMG.
